{
  "$schema": "http://json-schema.org/draft-07/schema#",
  "$id": "brand-to-server-mapping.schema.json",
  "title": "Brand-to-Server Mapping",
  "description": "Maps MCP server namespace identifiers to Azure brand names, short names, filenames, and optional merge-group configuration for multi-namespace services.",
  "type": "array",
  "items": {
    "type": "object",
    "required": ["brandName", "mcpServerName", "shortName", "fileName"],
    "properties": {
      "brandName": {
        "type": "string",
        "description": "Official Azure product brand name (e.g. 'Azure Cosmos DB')."
      },
      "mcpServerName": {
        "type": "string",
        "description": "MCP CLI namespace identifier (e.g. 'cosmos'). Must be unique across the array.",
        "pattern": "^[a-z][a-z0-9_]*$"
      },
      "shortName": {
        "type": "string",
        "description": "Abbreviated display name used in generated docs (e.g. 'Cosmos DB')."
      },
      "fileName": {
        "type": "string",
        "description": "Base filename for generated markdown (e.g. 'azure-cosmos-db'). No extension.",
        "pattern": "^[a-z][a-z0-9-]*$"
      },
      "composition": {
        "type": "string",
        "description": "Declares the relationship between this MCP namespace and the final output file(s). 'standalone': one namespace, one file. 'merge': this namespace is combined with others into a single article (requires mergeGroup/mergeOrder/mergeRole). 'split': this namespace is one fragment of a decomposed logical namespace; produces its own file (optionally also merged with split siblings via mergeGroup).",
        "enum": ["standalone", "merge", "split"],
        "default": "standalone"
      },
      "mergeGroup": {
        "type": "string",
        "description": "Group identifier for multi-namespace merge (e.g. 'azure-monitor'). All entries sharing a mergeGroup are merged into a single article.",
        "pattern": "^[a-z][a-z0-9-]*$"
      },
      "mergeOrder": {
        "type": "integer",
        "description": "Position within the merge group. 1 = primary namespace.",
        "minimum": 1
      },
      "mergeRole": {
        "type": "string",
        "description": "Role in the merge group. 'primary' owns frontmatter/overview; 'secondary' contributes tool sections only.",
        "enum": ["primary", "secondary"]
      }
    },
    "additionalProperties": false,
    "dependencies": {
      "mergeGroup": ["mergeOrder", "mergeRole"],
      "mergeOrder": ["mergeGroup", "mergeRole"],
      "mergeRole": ["mergeGroup", "mergeOrder"]
    },
    "allOf": [
      {
        "if": {
          "properties": { "composition": { "const": "standalone" } },
          "required": ["composition"]
        },
        "then": {
          "not": { "required": ["mergeGroup"] },
          "description": "standalone entries must not have mergeGroup"
        }
      },
      {
        "if": {
          "properties": { "composition": { "const": "merge" } },
          "required": ["composition"]
        },
        "then": {
          "required": ["mergeGroup", "mergeOrder", "mergeRole"],
          "description": "merge entries must have all three merge fields"
        }
      }
    ]
  },
  "minItems": 1,
  "uniqueItems": true
}
