[
  {
    "brandName": "Azure Container Apps",
    "mcpServerName": "containerapps",
    "shortName": "Container Apps",
    "fileName": "azure-container-apps",
    "composition": "standalone"
  },
  {
    "brandName": "Azure Container Registry",
    "mcpServerName": "acr",
    "shortName": "ACR",
    "fileName": "azure-container-registry",
    "composition": "standalone"
  },
  {
    "brandName": "Azure Advisor",
    "mcpServerName": "advisor",
    "shortName": "Advisor",
    "fileName": "azure-advisor",
    "composition": "standalone"
  },
  {
    "brandName": "Azure Data Manager for Energy",
    "mcpServerName": "adme",
    "shortName": "Data Manager for Energy",
    "fileName": "azure-data-manager-for-energy",
    "composition": "standalone"
  },
  {
    "brandName": "Azure Optimization",
    "mcpServerName": "optimization",
    "shortName": "Optimization",
    "fileName": "azure-optimization",
    "composition": "standalone"
  },
  {
    "brandName": "Azure Kubernetes Service",
    "mcpServerName": "aks",
    "shortName": "AKS",
    "fileName": "azure-kubernetes-service",
    "composition": "standalone"
  },
  {
    "brandName": "Azure App Configuration",
    "mcpServerName": "appconfig",
    "shortName": "App Config",
    "fileName": "azure-app-configuration",
    "composition": "standalone"
  },
  {
    "brandName": "Azure AppLens",
    "mcpServerName": "applens",
    "shortName": "AppLens",
    "fileName": "azure-applens",
    "composition": "standalone"
  },
  {
    "brandName": "Azure Application Insights",
    "mcpServerName": "applicationinsights",
    "shortName": "Application Insights",
    "fileName": "azure-application-insights",
    "composition": "standalone"
  },
  {
    "brandName": "Azure IoT Hub",
    "mcpServerName": "iothub",
    "shortName": "IoT Hub",
    "fileName": "azure-iot-hub",
    "composition": "standalone"
  },
  {
    "brandName": "Azure IoT Operations",
    "mcpServerName": "iotoperations",
    "shortName": "IoT Operations",
    "fileName": "azure-iot-operations",
    "composition": "standalone"
  },
  {
    "brandName": "Azure App Service",
    "mcpServerName": "appservice",
    "shortName": "App Service",
    "fileName": "azure-app-service",
    "composition": "standalone"
  },
  {
    "brandName": "Azure Backup",
    "mcpServerName": "azurebackup",
    "shortName": "Backup",
    "fileName": "azure-backup",
    "composition": "standalone"
  },
  {
    "brandName": "Azure Platform Landing Zone",
    "mcpServerName": "azuremigrate",
    "shortName": "Platform Landing Zone",
    "fileName": "azure-migrate",
    "composition": "standalone"
  },
  {
    "brandName": "Azure Terraform",
    "mcpServerName": "azureterraform",
    "shortName": "Terraform",
    "fileName": "azure-azureterraform",
    "composition": "standalone"
  },
  {
    "brandName": "Azure Terraform Best Practices",
    "mcpServerName": "azureterraformbestpractices",
    "shortName": "Terraform",
    "fileName": "azure-terraform-best-practices",
    "composition": "standalone"
  },
  {
    "brandName": "Azure Bicep Schema",
    "mcpServerName": "bicepschema",
    "shortName": "Bicep",
    "fileName": "azure-bicep-schema",
    "composition": "standalone"
  },
  {
    "brandName": "Azure Cloud Architect",
    "mcpServerName": "cloudarchitect",
    "shortName": "Cloud Architect",
    "fileName": "azure-cloud-architect",
    "composition": "standalone"
  },
  {
    "brandName": "Azure Communication Services",
    "mcpServerName": "communication",
    "shortName": "Communication Services",
    "fileName": "azure-communication-services",
    "composition": "standalone"
  },
  {
    "brandName": "Azure Compute",
    "mcpServerName": "compute",
    "shortName": "Compute",
    "fileName": "azure-compute",
    "composition": "standalone"
  },
  {
    "brandName": "Azure Confidential Ledger",
    "mcpServerName": "confidentialledger",
    "shortName": "Confidential Ledger",
    "fileName": "azure-confidential-ledger",
    "composition": "standalone"
  },
  {
    "brandName": "Azure Cosmos DB",
    "mcpServerName": "cosmos",
    "shortName": "Cosmos DB",
    "fileName": "azure-cosmos-db",
    "composition": "standalone"
  },
  {
    "brandName": "Azure Datadog",
    "mcpServerName": "datadog",
    "shortName": "Datadog",
    "fileName": "azure-datadog",
    "composition": "standalone"
  },
  {
    "brandName": "Azure Deploy",
    "mcpServerName": "deploy",
    "shortName": "Deploy",
    "fileName": "azure-deploy",
    "composition": "standalone"
  },
  {
    "brandName": "Azure Device Registry",
    "mcpServerName": "deviceregistry",
    "shortName": "Device Registry",
    "fileName": "azure-device-registry",
    "composition": "standalone"
  },
  {
    "brandName": "Azure Event Grid",
    "mcpServerName": "eventgrid",
    "shortName": "Event Grid",
    "fileName": "azure-event-grid",
    "composition": "standalone"
  },
  {
    "brandName": "Azure Event Hubs",
    "mcpServerName": "eventhubs",
    "shortName": "Event Hubs",
    "fileName": "azure-event-hubs",
    "composition": "standalone"
  },
  {
    "brandName": "Azure Compliance Quick Review",
    "mcpServerName": "extension_azqr",
    "shortName": "Compliance Quick Review",
    "fileName": "azure-compliance-quick-review",
    "composition": "split"
  },
  {
    "brandName": "Azure CLI Extension",
    "mcpServerName": "extension_cli_generate",
    "shortName": "CLI Extension",
    "fileName": "azure-cli-extension-generate",
    "composition": "split",
    "mergeGroup": "azure-cli-extension",
    "mergeOrder": 1,
    "mergeRole": "primary"
  },
  {
    "brandName": "Azure CLI Extension",
    "mcpServerName": "extension_cli_install",
    "shortName": "CLI Extension",
    "fileName": "azure-cli-extension-install",
    "composition": "split",
    "mergeGroup": "azure-cli-extension",
    "mergeOrder": 2,
    "mergeRole": "secondary"
  },
  {
    "brandName": "Azure File Shares",
    "mcpServerName": "fileshares",
    "shortName": "File Shares",
    "fileName": "azure-fileshares",
    "composition": "standalone"
  },
  {
    "brandName": "Microsoft Foundry Extensions",
    "mcpServerName": "foundryextensions",
    "shortName": "Foundry Extensions",
    "fileName": "microsoft-foundry-extensions",
    "composition": "standalone"
  },
  {
    "brandName": "Azure Functions",
    "mcpServerName": "functionapp",
    "shortName": "Functions",
    "fileName": "azure-functions",
    "composition": "merge",
    "mergeGroup": "azure-functions",
    "mergeOrder": 1,
    "mergeRole": "primary"
  },
  {
    "brandName": "Azure Functions",
    "mcpServerName": "functions",
    "shortName": "Functions",
    "fileName": "azure-functions-development",
    "composition": "merge",
    "mergeGroup": "azure-functions",
    "mergeOrder": 2,
    "mergeRole": "secondary"
  },
  {
    "brandName": "Azure Best Practices",
    "mcpServerName": "get_azure_bestpractices",
    "shortName": "Best Practices",
    "fileName": "azure-best-practices",
    "composition": "standalone"
  },
  {
    "brandName": "Azure Managed Grafana",
    "mcpServerName": "grafana",
    "shortName": "Grafana",
    "fileName": "azure-managed-grafana",
    "composition": "standalone"
  },
  {
    "brandName": "Azure Resource Group",
    "mcpServerName": "group",
    "shortName": "Resource Group",
    "fileName": "azure-resource-group",
    "composition": "standalone"
  },
  {
    "brandName": "Azure Key Vault",
    "mcpServerName": "keyvault",
    "shortName": "Key Vault",
    "fileName": "azure-key-vault",
    "composition": "standalone"
  },
  {
    "brandName": "Azure Data Explorer",
    "mcpServerName": "kusto",
    "shortName": "Data Explorer (Kusto)",
    "fileName": "azure-data-explorer",
    "composition": "standalone"
  },
  {
    "brandName": "Azure Load Testing",
    "mcpServerName": "loadtesting",
    "shortName": "Load Testing",
    "fileName": "azure-load-testing",
    "composition": "standalone"
  },
  {
    "brandName": "Azure Managed Lustre",
    "mcpServerName": "managedlustre",
    "shortName": "Managed Lustre",
    "fileName": "azure-managed-lustre",
    "composition": "standalone"
  },
  {
    "brandName": "Azure Marketplace",
    "mcpServerName": "marketplace",
    "shortName": "Marketplace",
    "fileName": "azure-marketplace",
    "composition": "standalone"
  },
  {
    "brandName": "Azure Monitor",
    "mcpServerName": "monitor",
    "shortName": "Monitor",
    "fileName": "azure-monitor",
    "composition": "merge",
    "mergeGroup": "azure-monitor",
    "mergeOrder": 1,
    "mergeRole": "primary"
  },
  {
    "brandName": "Azure Database for MySQL",
    "mcpServerName": "mysql",
    "shortName": "MySQL",
    "fileName": "azure-database-for-mysql",
    "composition": "standalone"
  },
  {
    "brandName": "Azure Policy",
    "mcpServerName": "policy",
    "shortName": "Policy",
    "fileName": "azure-policy",
    "composition": "standalone"
  },
  {
    "brandName": "Azure Database for PostgreSQL",
    "mcpServerName": "postgres",
    "shortName": "PostgreSQL",
    "fileName": "azure-database-for-postgresql",
    "composition": "standalone"
  },
  {
    "brandName": "Azure Pricing",
    "mcpServerName": "pricing",
    "shortName": "Pricing",
    "fileName": "azure-pricing",
    "composition": "standalone"
  },
  {
    "brandName": "Azure Quota",
    "mcpServerName": "quota",
    "shortName": "Quota",
    "fileName": "azure-quota",
    "composition": "standalone"
  },
  {
    "brandName": "Azure Managed Redis",
    "mcpServerName": "redis",
    "shortName": "Redis",
    "fileName": "azure-managed-redis",
    "composition": "standalone"
  },
  {
    "brandName": "Azure Resilience",
    "mcpServerName": "resilience",
    "shortName": "Resilience",
    "fileName": "azure-resilience",
    "composition": "standalone",
    "mergeGroup": null,
    "mergeOrder": null,
    "mergeRole": null
  },
  {
    "brandName": "Azure Resource Health",
    "mcpServerName": "resourcehealth",